{
  "schema_version": "0.3.0-beta",
  "gap_manifest_id": "macro-gaps-11111111111111111111111111111111",
  "matrix_id": "macro-matrix-22222222222222222222222222222222",
  "datapro_locked_cell_ids": [
    "macro-cell-33333333333333333333333333333333",
    "macro-cell-44444444444444444444444444444444"
  ],
  "gap_cells": [
    {
      "cell_id": "macro-cell-55555555555555555555555555555555",
      "key": {
        "indicator_code": "FP.CPI.TOTL",
        "entity_code": "CHN",
        "period": "2020",
        "frequency": "A"
      },
      "reason": "period_missing"
    }
  ],
  "official_requests": [
    {
      "gap_request_id": "macro-gap-request-66666666666666666666666666666666",
      "provider": "world_bank",
      "entity_code": "CHN",
      "indicator_code": "FP.CPI.TOTL",
      "periods": ["2020"],
      "research_request": {
        "time_range": {
          "start": "2020",
          "end": "2020"
        }
      }
    }
  ],
  "issue_codes": []
}
